{"inputs":{"calibration":{"sha256":"1144391dfc15c23cf25bda9ae9e018395e3448595002192c8c68ebb320ce4ca5"},"cases":{"sha256":"2e8fabaaa029eb48a36ac0afdf06fcc5d7396ab54c23e209e4932e70a82f6da7"},"questions":{"sha256":"86cb628c529dfc1ebc44ee81c3fb3c2ac2558e748b386e9e344fa4c49ba8e9a7"},"requirements":{"sha256":"270903c901f0fc80e655199b0f512ad61bc4e8fbeea851ed26f7afdb1247cec2"},"responses":{"sha256":"bd61ab4c4c59d5b1ce14d8e6571054001e699c18be830cecfce549d0946f3984"}},"outputs":{"EVALUATION.md":{"sha256":"4fd5750eaa81ee86d58f5ea9b1a24ab294ceb8c46b6c3c9c992b4751c1388e01"},"calibration.json":{"sha256":"1144391dfc15c23cf25bda9ae9e018395e3448595002192c8c68ebb320ce4ca5"},"cases.jsonl":{"sha256":"ba6ce03244d519125a80fdcd48d59bcb034fd87d8be34f801dff6b94c50329d7"},"evaluation.json":{"sha256":"7d0a7d1d79694c6e838465659f00797d3fc8de17d05a2ec7a56de408a78031a9"},"questions.json":{"sha256":"86cb628c529dfc1ebc44ee81c3fb3c2ac2558e748b386e9e344fa4c49ba8e9a7"},"requirements.json":{"sha256":"270903c901f0fc80e655199b0f512ad61bc4e8fbeea851ed26f7afdb1247cec2"},"responses.jsonl":{"sha256":"c3f5f4158364a033bd2fb2f4653afba15a187ea1fca323b5c6033f1ccf7ef02c"}},"produced_by":{"name":"jevdecision","version":"0.2.0"},"response_mode":"replay","response_origin":"unverified: supplied replay responses may be hand-written; model fields do not authenticate provider output","schema_version":3}