{"inputs":{"calibration":null,"cases":{"sha256":"7e42539cdd2655a67fbecf0e12a61b467b4b37222aa6c6f95d2c68a7c173bf8e"},"questions":{"sha256":"86cb628c529dfc1ebc44ee81c3fb3c2ac2558e748b386e9e344fa4c49ba8e9a7"},"requirements":null,"responses":{"sha256":"f43ed20be4555a42c0a7e360b984fb2dc144b93754e930259fc4e0eb35b559ba"}},"outputs":{"EVALUATION.md":{"sha256":"834c00ef0a20d145391db5324fe0d26c8f08638e7296cc9a040d7f84df8cf76a"},"calibration.json":{"sha256":"1144391dfc15c23cf25bda9ae9e018395e3448595002192c8c68ebb320ce4ca5"},"cases.jsonl":{"sha256":"41f9fae86ad75f496568a9208710b38db628e42df65ac0e7163d726769b7da47"},"evaluation.json":{"sha256":"73c44102d3e3fd4cd4b6e3f235457f1d00c9c10682c024bc76686acd039ad1fa"},"questions.json":{"sha256":"86cb628c529dfc1ebc44ee81c3fb3c2ac2558e748b386e9e344fa4c49ba8e9a7"},"responses.jsonl":{"sha256":"7d6dfadd66d908ffc1bf1c7af6f7c69eba2e320ea7f69163afaac88407de6f2d"}},"produced_by":{"name":"jevdecision","version":"0.2.0"},"response_mode":"replay","response_origin":"unverified: supplied replay responses may be hand-written; model fields do not authenticate provider output","schema_version":3}